name,price,barcode,details
jason-bourne-(1,£19.99,5053083093129,"Actors,Tommy Lee Jones, Riz Ahmed, Matt Damon, Ato Essandoh, Bill Camp, Alicia Vikander, Neve Gachev, Scott Shepherd, Vincent Cassel, Scott Shepherd, Julia Stiles,Directed by,Paul Greengrass,Additional info,Language(s): English, Hard of Hearing Subtitles: English, Interactive Menu,No. of discs,2 disc(s),Duration,123 mins"
the-blues-brothers-(1,£19.99,5053083213305,"Actors,Charles Napier, Ray Charles, Aretha Franklin, James Brown, Paul Reubens, Steven Spielberg, Carrie Fisher, John Candy, Dan Aykroyd, Henry Gibson, Cab Calloway, John Belushi, Frank Oz, Steve Lawrence, John Lee Hooker, Twiggy, The Blues Brothers Band,Directed by,John Landis,Additional info,Language(s): English, Interactive Menu,No. of discs,2 disc(s),Duration,127 mins"
the-bourne-legac,£19.99,5053083111175,"Actors,Oscar Isaac, Corey Stoll, Edward Norton, Donna Murphy, Rachel Weisz, Albert Finney, Jeremy Renner, Stacy Keach, Joan Allen, Scott Glenn, David Strathairn, Dennis Boutsikaris,Directed by,Tony Gilroy,Additional info,Language(s): English, French, Canadian French, Latin American Spanish, Hard of Hearing Subtitles: English, Subtitles: 4KUHD: French, Swedish, Danish, Finnish, Dutch, Norwegian. Blu-ray: Canadian French, Latin American Spanish., Interactive Menu, Scene Access, Screen ratio 1:2.40, 7.1 DTS-HD Master Audio, DTS 5.1, Dolby Digital 2.0,No. of discs,2 disc(s),Duration,136 mins"
the-boss-bab,£19.99,5053083156725,"Directed by,Tom McGrath,Additional info,Anamorphic (16:9), Language(s): English, Hard of Hearing Subtitles: English, Subtitles: English, Interactive Menu, Screen ratio 1:2.35,No. of discs,2 disc(s),Duration,94 mins"
mamma-mia!-here-we-go-agai,£19.99,5053083170738,"Actors,Amanda Seyfried, Dominic Cooper, Meryl Streep, Lily James, Julie Walters, Stellan Skarsgard, Stellan Skarsgard, Pierce Brosnan, Colin Firth, Christine Baranski, Cher, Andy Garcia, Stellan Skarsgard,Directed by,Ol Parker,Additional info,Language(s): English, Spanish, French, Hard of Hearing Subtitles: English, Subtitles: Czech, Danish, Dutch, Finnish, French, Greek, Hungarian, Norwegian, Polish, Swedish, Interactive Menu, Screen ratio 1:2.40,No. of discs,3 disc(s),Duration,94 mins"
jason-bourn,£19.99,5053083111144,"Actors,Tommy Lee Jones, Riz Ahmed, Matt Damon, Ato Essandoh, Bill Camp, Alicia Vikander, Neve Gachev, Scott Shepherd, Vincent Cassel, Scott Shepherd, Julia Stiles,Directed by,Paul Greengrass,Additional info,Language(s): English, Latin American Spanish, French, Hard of Hearing Subtitles: English, Subtitles: Danish, Dutch, Finnish, French, Latin American Spanish, Norwegian, Swedish, Interactive Menu, Screen ratio 1:2.40, DTS 7.1, DTS 5.1,No. of discs,2 disc(s),Duration,123 mins"
troll,£19.99,5053083156732,"Directed by,Walt Dohrn, Mike Mitchell,Additional info,Anamorphic (16:9), Language(s): English, Hard of Hearing Subtitles: English, Subtitles: English, Interactive Menu, Screen ratio 1:2.35,No. of discs,2 disc(s),Duration,88 mins"
interstella,£19.99,5051892209847,"Actors,Jessica Chastain, Michael Caine, Ellen Burstyn, Wes Bentley, Anne Hathaway, Matthew McConaughey, John Lithgow, Timothee Chalamet, Casey Affleck, Topher Grace,Directed by,Christopher Nolan,Additional info,Anamorphic (16:9), Language(s): 4K: English, French, Brazilian Portuguese, Castilian Spanish, Czech, Italian, Latin Spanish, Polish, Russian; Blu-ray: English, German, Blu-ray: Castilian Spanish, Hard of Hearing Subtitles: 4K: English, German, Italian; Blu-ray: English, German, Subtitles: 4K: Arabic, Brazilian Portuguese, Cantonese, Castilian Spanish, Complex Chinese, Croatian, Czech, Danish, Dutch, Finish, French, Greek, Hebrew, Hungarian, Korean, Latin Spanish, Norwegian, Polish, Portuguese, Romanian, Russian, Swedish; Blu-ray: Castilian Spanish, Danish, Finnish, Icelandic, Norwegian, Swedish, Interactive Menu, Screen ratio 1:2.40, 5.1 DTS-HD Master Audio, Dolby Digital 5.1,No. of discs,3 disc(s),Duration,169 mins"
pa,£19.99,5051892199803,"Actors,Garrett Hedlund, Amanda Seyfried, Cara Delevingne, Nonso Anozie, Rooney Mara, Paul Kaye, Hugh Jackman, Adeel Akhtar, Levi Miller, Kathy Burke,Directed by,Joe Wright,Additional info,Language(s): English, Interactive Menu,No. of discs,2 disc(s),Duration,111 mins"
spectr,£19.99,5039036095464,"Actors,Dave Bautista, Ralph Fiennes, Daniel Craig, Naomie Harris, Christoph Waltz, Rory Kinnear, Lea Seydoux, Andrew Scott, Monica Bellucci, Ben Whishaw,Directed by,Sam Mendes,Additional info,Language(s): English, Hard of Hearing Subtitles: English, Interactive Menu, Screen ratio 1:1.78, 7.1 DTS-HD Master Audio, Dolby Digital 5.1,No. of discs,2 disc(s),Duration,142 mins"
i,£19.99,5051892211475,"Actors,Steven Williams, Javier Botet, Megan Charpentier, Bill Skarsgard, Nicholas Hamilton, Owen Teague, Finn Wolfhard, Jaeden Liberher, Sophia Lillis, Wyatt Oleff, Jackson Robert Scott, Jeremy Ray Taylor, Jaeden Lieberher,Directed by,Andy Muschietti,Additional info,Language(s): English, 4K: French, German, Castilian Spanish, Czech, Italian, Polish, Hard of Hearing Subtitles: English, German, Italian, Subtitles: 4K: Castilian Spanish, Czech, Danish, Dutch, Finnish, French, Polish, Norwegian, Swedish. Blu-ray: Bulgarian, Castilian Spanish, Croatian, Estonian, Greek, Hebrew, Latvian, Lithuanian, Slovenian, Interactive Menu, Screen ratio 1:1.78, Dolby TrueHD, 5.1 DTS-HD Master Audio, Dolby Digital 5.1,No. of discs,2 disc(s),Duration,135 mins"
abominabl,£19.99,5053083207571,"Directed by,Jill Culton, Todd Wilderman,Additional info,Language(s): English, Hard of Hearing Subtitles: English, Interactive Menu, Screen ratio 1:1.85,No. of discs,1 disc(s),Duration,97 mins"
the-secret-life-of-pets-,£19.99,5053083196257,"Directed by,Chris Renaud, Jonathan del Val,Additional info,Language(s): English, Anglicized English, Hard of Hearing Subtitles: English, Interactive Menu, Screen ratio 1:1.85,No. of discs,2 disc(s),Duration,86 mins"
the-mul,£19.99,5051892220590,"Actors,Laurence Fishburne, Dianne Wiest, Clint Eastwood, Michael Pena, Andy Garcia, Bradley Cooper, Loren Dean, Ignacio Serricchio, Taissa Farmiga, Alison Eastwood,Directed by,Clint Eastwood,Additional info,Language(s): English, 4K: Castilian Spanish, Czech, French, German, Italian, Polish, Russian; Blu-ray: Castilian Spanish, Hard of Hearing Subtitles: English, German, Italian, Subtitles: 4K: Castilian Spanish, Complex Chinese, Czech, Danish, Dutch, Finnish, French, Greek, Norwegian, Polish, Portuguese, Romanian, Russian, Swedish; Blu-ray: Castilian Spanish, Danish, Dutch, Finnish, French, Greek, Norwegian, Swedish, Interactive Menu, Screen ratio 1:1.78, 5.1 DTS-HD Master Audio, Dolby Digital 5.1,No. of discs,2 disc(s),Duration,116 mins"
first-ma,£19.99,5053083173869,"Actors,Pablo Schreiber, Corey Stoll, Kyle Chandler, Ryan Gosling, Claire Foy, Christopher Abbott, Brian d'Arcy James, Ciaran Hinds, Patrick Fugit, Shea Whigham, Jason Clarke,Directed by,Damien Chazelle,Additional info,Language(s): English, Hard of Hearing Subtitles: English, Interactive Menu, Screen ratio 1:2.39,No. of discs,2 disc(s),Duration,141 mins"
warcraft-the-beginning-(1,£19.99,5053083093112,"Actors,Dominic Cooper, Toby Kebbell, Ruth Negga, Paula Patton, Travis Fimmel, Ben Schnetzer, Robert Kazinsky, Rob Kazinsky, Ben Foster, Daniel Wu, Anna Galvin,Directed by,Duncan Jones,Additional info,Language(s): English, Spanish, French, German, Hindi, Italian, Hard of Hearing Subtitles: English, Subtitles: Arabic, Spanish, Danish, Dutch, Finnish, French, German, Hindi, Icelandic, Italian, Norwegian, Portuguese, Swedish, Interactive Menu, Scene Access, Screen ratio 1:2.40, Dolby Digital 5.1, Dolby Digital 2.0,No. of discs,2 disc(s),Duration,130 mins"
bill-ted-face-the-musi,£19.99,5051892226981,"Actors,William Sadler, Keanu Reeves, Jayma Mays, Kristen Schaal, Holland Taylor, Alex Winter, Brigette Lundy-Paine, Samara Weaving, Anthony Carrigan, Erinn Hayes,Directed by,Dean Parisot,Additional info,Language(s): 4K: English, Blu-ray: English, Hard of Hearing Subtitles: English, Interactive Menu, Screen ratio 1:1.78, Dolby TrueHD, 5.1 DTS-HD Master Audio,No. of discs,2 disc(s),Duration,92 mins"
apollo-1,£19.99,5053083113735,"Actors,Kathleen Quinlan, Kevin Bacon, David Andrews, Tom Hanks, Bill Paxton, Ed Harris, Gary Sinise, Joe Spano, Max Elliott Slade, Tracy Reiner, Miko Hughes, Max Elliot Slade, Jean Speegle Howard, Mary Kate Schellhardt, Emily Ann Lloyd, Jean Speegle Howard, Chris Ellis,Directed by,Ron Howard,Additional info,Language(s): Disc 1: English, Czech, French, Polish, Disc 2: English, Brazilian Portuguese, German, Italian, Japanese, Latin American Spanish, Hard of Hearing Subtitles: English, Subtitles: Disc 1: Complex Mandarin, Czech, Danish, Dutch, Finnish, French, Greek, Norwegian, Polish, Swedish; Disc 2: Brazilian Portuguese, Spanish, Danish, Dutch, Finnish, Canadian French, French, German,  Italian, Japanese, Latin American Spanish, Norwegian, Swedish, Interactive Menu, Screen ratio 1:2.35, DTS 5.1,No. of discs,2 disc(s),Duration,134 mins"
ender-s-gam,£19.99,5053083227494,"Actors,Ben Kingsley, Harrison Ford, Viola Davis, Nonso Anozie, Abigail Breslin, Moises Arias, Asa Butterfield, Aramis Knight, Hailee Steinfeld,Directed by,Gavin Hood,Additional info,Language(s): English, Hard of Hearing Subtitles: English, Interactive Menu, Screen ratio 1:2.40,No. of discs,2 disc(s),Duration,114 mins"
the-accountan,£19.99,5051892204194,"Actors,Jeffrey Tambor, Anna Kendrick, Ben Affleck, J.K. Simmons, John Lithgow, Jon Bernthal, Fernando Chien, Cynthia Addai-Robinson, Alison Wright, Kelly Collins Lintz,Directed by,Gavin O'Connor,Additional info,Language(s): English, Brazilian Potuguese, Castilian Spanish, Czech, French, German, Italian, Latin Spanish, Polish, Hard of Hearing Subtitles: English, German, Italian, Subtitles: 4K Blu-ray: Arabic, Brazilian Portuguese,Cantonese, Castilian Spanish, Complex Chinese, Czech, Danish, Dutch, Finnish, French, Korean, Latin Spanish, Norwegian, Swedish.  Blu-ray: Castilian Spanish, Danish, Dutch, Finnish, French, Greek, Icelandic, Norwegian, Swedish, Interactive Menu, Screen ratio 1:1.78, 7.1 DTS-HD Master Audio, Dolby Digital 5.1,No. of discs,2 disc(s),Duration,128 mins"
doctor-sleep-(1,£19.99,5051892227834,"Actors,Emily Alyn Lind, Ewan McGregor, Bruce Greenwood, Carl Lumbly, Jocelin Donahue, Rebecca Ferguson, Alex Essoe, Zahn McClarnon, Kyliegh Curran, Zackary Momoh,Directed by,Mike Flanagan,Additional info,Language(s): English, 4K: Canadian French, Italian, Latin Spanish, Russian; Blu-ray: Castilian Spanish, Parisian French, Russian, Hard of Hearing Subtitles: English, Italian, Subtitles: Arabic, Castilian Spanish, Danish, Dutch, Estonian, European Portuguese, Finnish, Greek, Korean, Latvian, Lithuanian, Norwegian, Parisian French, Russian, Simplified Chinese, Swedish, Interactive Menu, Screen ratio 1:1.78, Dolby TrueHD, Dolby Digital 5.1,No. of discs,2 disc(s),Duration,152 mins"
ready-player-on,£19.99,5051892212090,"Actors,T.J. Miller, Simon Pegg, Mark Rylance, Ben Mendelsohn, Tye Sheridan, Olivia Cooke, Lena Waithe, Hannah John-Kamen, Win Morisaki, Philip Zhao,Directed by,Steven Spielberg,Additional info,Language(s): English, 4K: German, Blu-ray: Castilian Spanish, Italian, Hard of Hearing Subtitles: 4K: English, German. Blu-ray: English, Italian, Subtitles: 4K: Croatian, Greek, Hebrew, Portuguese. Blu-ray: Castilian Spanish, Danish, Finnish, Greek, Norwegian, Swedish, Interactive Menu, Screen ratio 1:1.78, Dolby TrueHD, 5.1 DTS-HD Master Audio, Dolby Digital 5.1,No. of discs,2 disc(s),Duration,138 mins"
blackkklansma,£19.99,5053083174057,"Actors,Adam Driver, Ashlie Atkinson, Ryan Eggold, Jasper Paakkonen, Corey Hawkins, John David Washington, Paul Walter Hauser, Laura Harrier, Robert John Burke, Topher Grace,Directed by,Spike Lee,Additional info,Language(s): English, BR: French, Hard of Hearing Subtitles: English, Subtitles: BR: Arabic, Dutch, French, Interactive Menu, Screen ratio 1:2.40,No. of discs,2 disc(s),Duration,135 mins"
the-prestig,£19.99,5051892211024,"Actors,Christian Bale, David Bowie, Rebecca Hall, Michael Caine, Andy Serkis, Scarlett Johansson, Hugh Jackman, Daniel Davis, Samantha Mahurin, Piper Perabo,Directed by,Christopher Nolan,Additional info,Anamorphic (16:9), Language(s): 4K: English, French, German, 4K: Brazilian Portuguese, Castilian Spanish, Czech, Hungarian, Italian, Latin Spanish, Mandarin, Polish, Russian, Thai, Turkish; Blu-ray: English, Hard of Hearing Subtitles: English, Subtitles: 4K: German SDH, Italian SDH, Arabic, Brazilian Portuguese, Cantonese, Castilian Spanish, Complex Chinese, Croatian, Czech, Danish, Dutch, Finnish, French, Greek, Hebrew, Hungarian, Hungarian, Korean, Latin Spanish, Norwegian, Polish, Portuguese, Romanian, Russian, Simplified Chinese, Swedish, Thai, Turkish; Blu-ray: English, German, French, Castilian Spanish, Dutch, Swedish, Norwegian, Danish, Finnish, Interactive Menu, Screen ratio 1:2.35, 5.1 DTS-HD Master Audio, Dolby Digital,No. of discs,3 disc(s),Duration,130 mins"
american-mad,£19.99,5053083135935,"Actors,Caleb Landry Jones, Domhnall Gleeson, Tom Cruise, Jayma Mays, Jesse Plemons, Sarah Wright, Lola Kirke, Alejandro Edda, Caleb Landry Jones, Sarah Wright Olsen, Jed Rees, E. Roger Mitchell, Connor Trinneer, Benito Martinez,Directed by,Doug Liman,Additional info,Language(s): English, Hard of Hearing Subtitles: English, Interactive Menu, Screen ratio 1:1.85,No. of discs,2 disc(s),Duration,155 mins"
the-wizard-of-o,£19.99,5051892223997,"Actors,Judy Garland, Margaret Hamilton, Charley Grapewin, Clara Blandick, Ray Bolger, Jack Haley, Bert Lahr, Mitchell Lewis, Frank Morgan, Singer Midgets, The, Billie Burke, Pat Walsh,Directed by,King Vidor, Victor Fleming,Additional info,Language(s): English, 4K: French, German, Russian, Thai; Blu-ray: French, 4K: Latin Spanish, Czech, Hungarian, Polish; Blu-ray: Brazilian Portuguese, Castilian Spanish, Italian, Hard of Hearing Subtitles: English, German, Italian (Blu-ray), Subtitles: 4K: Arabic, Castilian Spanish, Complex Chinese, Czech, Dutch, French, Hungarian, Korean, Latin Spanish, Polish, Russian, Thai; Blu-ray: Brazilian Portuguese, Castilian Spanish, Complex Chinese, Danish, Dutch, Finnish, French, Latin Spanish, Norwegian, Swedish, Interactive Menu, Screen ratio 1:1.78, 5.1 DTS-HD Master Audio, Dolby Digital 5.1, Dolby Mono,No. of discs,2 disc(s),Duration,102 mins"
blade-runner-the-final-cu,£19.99,5051892209472,"Actors,William Sanderson, M. Emmet Walsh, Joseph Turkel, Harrison Ford, Joanna Cassidy, Rutger Hauer, Sean Young, Edward James Olmos, Daryl Hannah, Brion James,Directed by,Ridley Scott,Additional info,Language(s): 4K Blu-ray: English, 4K Blu-ray: Brazilian, Czech, French, German, Italian, Polish, Portuguese, Russian, 4K Blu-ray: Latin Spanish, Blu-ray: English, Castilian Spanish, Subtitles: 4K Blu-ray: Arabic, Brazilian Portuguese, Cantonese, Castilian Spanish, Complex Chinese, Danish, Dutch, English, European Portuguese, Finnish, French, German, Hebrew, Italian, Korean, Latin Spanish, Norwegian, Polish, Russian, Simplified Chinese, Swedish, Turkish. Blu-ray: Castilan Spanish, Danish, Dutch, English, Finnish, French, German, Italian, Norwegian, Portuguese, Swedish, Interactive Menu, Screen ratio 1:1.78, Dolby TrueHD, Dolby Digital 5.1, Dolby Digital 2.0, Dolby Digital 5.1,No. of discs,2 disc(s),Duration,117 mins"
dunkir,£19.99,5051892210034,"Actors,Tom Hardy, Aneurin Barnard, Jack Lowden, Harry Styles, Fionn Whitehead, James D'Arcy, Cillian Murphy, Mark Rylance, Kenneth Branagh,Directed by,Christopher Nolan,Additional info,Language(s): English, French (4K), Italian, 4K: Czech, Hungarian, Mandarin, Polish, Russian, Thai, Turkish. Blu-ray: Castilian Spanish, Hard of Hearing Subtitles: English, Italian, Subtitles: 4K: Arabic, Cantonese, Complex Chinese, Croatian, Czech, Danish, Dutch, Finnish, French, Greek, Hebrew, Hungarian, Korean, Norwegian, Polish, Portuguese, Romanian, Russian, Simplified Chinese, Swedish, Thai, Turkish. Blu-ray: Castilian Spanish, Danish, Finnish, Norwegian, Swedish, Interactive Menu, Screen ratio 1:1.78, 5.1 DTS-HD Master Audio, Dolby Digital 5.1,No. of discs,3 disc(s),Duration,106 mins"
john-wick-(1,£19.99,5051892209205,"Actors,Willem Dafoe, Alfie Allen, Keanu Reeves, Ian McShane, John Leguizamo, Dean Winters, Adrianne Palicki, Omer Barnea, Bridget Moynahan, Michael Nyqvist,Directed by,Chad Stahelski,Additional info,Language(s): English, Russian, Hard of Hearing Subtitles: English, Subtitles: English, Interactive Menu, Screen ratio 1:1.78, Dolby TrueHD, Dolby Digital 5.1,No. of discs,2 disc(s),Duration,101 mins"
king-arthur-legend-of-the-swor,£19.99,5051892205689,"Actors,Annabelle Wallis, Aidan Gillen, Djimon Hounsou, Eric Bana, Jude Law, Charlie Hunnam, Katie McGrath, Astrid Berges-Frisbey, Kingsley Ben-Adir, Hermione Corfield, David Beckham, Mikael Persbrandt,Directed by,Guy Ritchie,Additional info,Language(s): English, Italian, 4K: Castilian Spanish, Czech, Hungarian, Polish, Russian, Thai, Castilian Spanish, French, Hard of Hearing Subtitles: English, German, Italian, Subtitles: 4K; Arabic, Cantonese, Castilian Spanish, Compex Chinese, Czech, Danish, Dutch, European Portuguese, Finnish, French, Hugarian, Korean, Norwegian, Polish, Russian, Swedish, Thai. Blu-ray: Castilian Spanish, Danish, Dutch, Finnish, French, Icelandic, Norwegian, Swedish, Interactive Menu, Screen ratio 1:1.78, Dolby TrueHD, 5.1 DTS-HD Master Audio, Dolby Digital 5.1, Dolby Digital 5.1,No. of discs,2 disc(s),Duration,126 mins"
sherlock-holme,£19.99,5051892228022,"Actors,Rachel McAdams, Mark Strong, Robert Downey Jr, James Fox, Jude Law, Bronagh Gallagher, Kelly Reilly, Hans Matheson, Geraldine James, Eddie Marsan,Directed by,Guy Ritchie,Additional info,Language(s): English, 4K: Canadian French, Castilian Spanish, Czech, Hungarian, Latin Spanish, Parisian French, Polish, Thai; Blu-ray: Castilian Spanish, French, German, Italian, Hard of Hearing Subtitles: 4K: English, German; Blu-ray: English, Subtitles: 4K: Arabic, Canadian French, Cantonese, Castilian Spanish, Complex Chinese, Czech, Danish, Dutch, Finnish, Hungarian, Korean, Latin Spanish, Norwegian, Parisian French, Polish, Romanian, Simplified Chinese, Swedish, Thai; Blu-ray: Castilian Spanish, Danish, Dutch, Finnish, French, German, Italian, Norwegian, Portuguese, Swedish, Interactive Menu, Screen ratio 1:1.78, 5.1 DTS-HD Master Audio, Dolby Digital 5.1,No. of discs,2 disc(s),Duration,129 mins"
creed-i,£19.99,5051892220477,"Actors,Tessa Thompson, Sylvester Stallone, Michael B. Jordan, Dolph Lundgren, Milo Ventimiglia, Andre Ward, Florian Munteanu, Phylicia Rashad, Brigitte Nielsen, Russell Hornsby,Directed by,Steven Caple Jr.,Additional info,Language(s): English, 4K: French, Latin Spanish; Blu-ray: Castilian Spanish, French, German, Italian, Hard of Hearing Subtitles: 4K: English; Blu-ray: English, German, Italian, Subtitles: 4K: Danish, Finnish, French, Latin Spanish, Norwegian, Swedish; Blu-ray: Castilian Spanish, Danish, Dutch, Finnish, French, Greek, Norwegian, Swedish, Interactive Menu, Screen ratio 1:1.78, Dolby TrueHD, 5.1 DTS-HD Master Audio, Dolby Digital 5.1,No. of discs,2 disc(s),Duration,130 mins"
fantastic-beasts-the-crimes-of-grindelwal,£19.99,5051892219310,"Actors,Ezra Miller, Johnny Depp, Jude Law, Eddie Redmayne, Dan Fogler, Zoe Kravitz, Katherine Waterston, Callum Turner, Alison Sudol, Claudia Kim,Directed by,David Yates,Additional info,Language(s): English, Blu-ray: Italian, Blu-ray: Catalan, Castilian Spanish, Czech, Russian; 4K: Castilian Spanish, Catalan, Hard of Hearing Subtitles: English, Italian (Blu-ray only), Subtitles: Blu-ray: Castilian Spanish, Czech, Danish, Estonian, Finnish, Greek, Icelandic, Latvian, Lithuanian, Norwegian, Russian, Slovakian, Swedish; 4K:  Castilian Spanish, Danish, Finnish, Norwegian, Portuguese, Swedish, Interactive Menu, Screen ratio 1:1.78, Dolby TrueHD, 5.1 DTS-HD Master Audio, Dolby Digital 5.1,No. of discs,3 disc(s),Duration,133 mins"
the-invisible-ma,£19.99,5053083215132,"Actors,Nash Edgerton, Michael Dorman, Oliver Jackson-Cohen, Benedict Hardie, Storm Reid, Elisabeth Moss, Aldis Hodge, Harriet Dyer, Amali Golden, Zara Michales,Directed by,Leigh Whannell,Additional info,Language(s): English, Interactive Menu,No. of discs,2 disc(s),Duration,124 mins"
american-gangste,£19.99,5053083203528,"Actors,Joe Morton, Josh Brolin, Cuba Gooding Jr., Chiwetel Ejiofor, Idris Elba, Ruby Dee, Russell Crowe, John Ortiz, Yul Vazquez, Lymari Nadal, Denzel Washington, John Hawkes, Cuba Gooding, Jr., Tip 'T.I.' Harris, Lonnie ""Common"" Lynn, Carla Gugino, Ted Levine, Roger Guenveur Smith, Armand Assante, RZA, Tip &#39;T.I.&#39; Harris, Cuba Gooding, Jr.,Directed by,Ridley Scott,Additional info,Language(s): Disc 1: English, Czech, French, Hungarian, Russian, Polish (Voiceover), Disc 2: English, Italian, German, Spanish, Japanese, Hard of Hearing Subtitles: English, Subtitles: Disc 1: Czech, Danish, Dutch, Finnish, French, Greek, Hungarian, Norwegian, Polish, Romanian, Swedish. Disc 2: French, Italian, German, Spanish, Japanese, Danish, Dutch, Finnish, Korean, Norwegian, Portuguese, Swedish, Traditional Mandarin., Interactive Menu, Screen ratio 1:1.85,No. of discs,2 disc(s),Duration,541 mins"
skyscrape,£19.99,5053083170721,"Actors,Pablo Schreiber, Byron Mann, Noah Taylor, Dwayne Johnson, Jason Day, Roland Moller, Hannah Quinlivan, Dwayne 'The Rock' Johnson, Neve Campbell, Chin Han, Byron Lawson, Dwayne &#39;The Rock&#39; Johnson,Directed by,Rawson Marshall Thurber,Additional info,Language(s): English, Czech, French, Hungarian, Polish, Hard of Hearing Subtitles: English, Subtitles: Cantonese, Complex Mandarin, Czech, Danish, Dutch, Finnish, French, Greek, Hungarian, Korean, Norwegian, Polish, Romanian, Swedish, Interactive Menu, Screen ratio 1:2.40,No. of discs,2 disc(s),Duration,98 mins"
the-tow,£19.99,5051892204880,"Actors,Blake Lively, Ben Affleck, Rebecca Hall, Jon Hamm, Jeremy Renner, Brian Scannell, Slaine, Jeff Martineau, Gary Galone, Chris Cooper,Directed by,Ben Affleck,Additional info,Language(s): English, Brazilian Portuguese, Castilian Spanish, French, German, Italian, Latin Spanish, Polish, Russian, Thai, Turkish, Hard of Hearing Subtitles: English, German, Italian, Subtitles: English, Arabic, Cantonese, Castilian Spanish, Complex Chinese, Czech, Danish, Dutch, Finnish, French, Hebrew, Korean, Latin Spanish, Polish, Portuguese, Norwegian, Swedish, Russian, Turkish, Interactive Menu, Screen ratio 1:1.78, 5.1 DTS-HD Master Audio,No. of discs,2 disc(s),Duration,278 mins"
beetlejuic,£19.99,5051892228855,"Actors,Michael Keaton, Jeffrey Jones, Glenn Shadix, Winona Ryder, Alec Baldwin, Catherine O'Hara, Sylvia Sidney, Annie McEnroe, Geena Davis,Directed by,Tim Burton,Additional info,Language(s): English, 4K: Canadian French, Castilian Spanish, Czech, German, Italian, Latin Spanish, Mandarin, Parisian French; Blu-ray: Castilian Spanish, French, Blu-ray: English, Hard of Hearing Subtitles: 4K: English, German, Italian, Subtitles: 4K: Castilian Spanish, Complex Chinese, Czech, Danish, Dutch, Finnish, Korean, Latin Spanish, Norwegian, Parisian French, Simplified Chinese, Swedish, Thai; Blu-ray: English, Brazilian Portuguese, Castilian Spanish, Complex Chinese, Danish, Dutch, Finnish, French, German, Italian, Korean, Latin Spanish, Norwegian, Portuguese, Swedish, Interactive Menu, Screen ratio 1:1.78, Dolby TrueHD, Dolby Digital 2.0, Dolby Digital 5.1,No. of discs,2 disc(s),Duration,92 mins"
it-chapter-two-(2,£19.99,5051892227131,"Actors,Jessica Chastain, Bill Hader, Bill Skarsgard, Finn Wolfhard, Sophia Lillis, Jeremy Ray Taylor, James McAvoy, Jay Ryan, Jaeden Lieberher, Isaiah Mustafa,Directed by,Andy Muschietti,Additional info,Language(s): English, Interactive Menu,No. of discs,2 disc(s),Duration,169 mins"
the-lego-movie-,£19.99,5051892220576,"Directed by,Mike Mitchell,Additional info,Language(s): English, Blu-ray: Catalan, Castilian Spanish, Italian, 4K: English, Parisian French, Bulgarian, Cantonese, Catalan, Dutch, European Portuguese, Flemish, Hungarian, Korean, Romanian, Taiwanese Mandarin, Thai, Hard of Hearing Subtitles: English, Italian (Blu-ray), Subtitles: 4K: Arabic, Bulgarian, Cantonese, Complex Chinese, Dutch, European Portuguese, Hungarian, Korean, Parisian French, Romanian, Russian, Simplified Chinese, Thai; Blu-ray: Castilian Spanish, Interactive Menu, Screen ratio 1:1.78, Dolby TrueHD, 5.1 DTS-HD Master Audio, Dolby Digital 5.1, Dolby Digital 5.1,No. of discs,2 disc(s),Duration,143 mins"
mad-max-fury-roa,£19.99,5051892199797,"Actors,Tom Hardy, Rosie Huntington-Whiteley, Charlize Theron, Nicholas Hoult, Nathan Jones, Zoe Kravitz, Riley Keough, Josh Helman, Megan Gale, Hugh Keays-Byrne,Directed by,George Miller,Additional info,Language(s): 4K: English, French; Blu-ray: English, Castilian Spanish, Italian, Hard of Hearing Subtitles: English, Italian, Subtitles: 4K: Complex Chinese, Castilian Spanish, Danish, Dutch, Finnish, French, Norwegian, Swedish; Blu-ray: Castilian Spanish, Danish, Finnish, Greek, Icelandic, Norwegian, Swedish, Interactive Menu, Screen ratio 1:1.78, Dolby TrueHD, Dolby Digital 5.1,No. of discs,2 disc(s),Duration,120 mins"
yesterda,£19.99,5053083199166,"Actors,Ana de Armas, Lily James, Meera Syal, James Corden, Camilla Rutherford, Joel Fry, Sophia Di Martino, Ed Sheeran, Kate McKinnon, Himesh Patel, Sanjeev Bhaskar,Directed by,Danny Boyle,Additional info,Language(s): English, Disc 1: Czech, Polish (voiceover), French, Hungarian, Disc 2: Spanish, Hard of Hearing Subtitles: English, Subtitles: Disc 1- 4kUHD: Cantonese, Complex Mandarin, Czech, Danish, Dutch, Finnish, French, Greek, Hindi, Hungarian, Korean, Norwegian, Polish, Romanian, Swedish. Disc 2- 2D BD: Arabic, Spanish, Danish, Dutch, Finnish, French, Hindi, Icelandic, Norwegian, Portuguese, Swedish, Interactive Menu, Screen ratio 1:2.39,No. of discs,2 disc(s),Duration,116 mins"
